{
  "format": "atlas-content-pack",
  "schemaVersion": 1,
  "payloadSchema": "atlas.bundle@2",
  "id": "atlas.interview-samples",
  "version": "1.1.0",
  "title": "Interview Preparation",
  "visibility": "public",
  "files": {
    "projects": "projects.json",
    "pages": "pages",
    "glossary": "glossary.json"
  },
  "requires": [],
  "assets": [],
  "provenance": {
    "kind": "author-created",
    "note": "Original reasoning-first samples plus synthetic Article/QCM playground data for AtlasNote UI testing. No private library content, credentials or third-party assets."
  }
}
