{
  "format": "atlas-content-pack",
  "schemaVersion": 1,
  "payloadSchema": "atlas.bundle@2",
  "id": "example.notes",
  "version": "1.1.0",
  "title": "Public authoring example",
  "visibility": "public",
  "files": {
    "projects": "projects.json",
    "pages": "pages",
    "glossary": "glossary.json"
  },
  "requires": [],
  "assets": [],
  "provenance": {
    "kind": "new-illustrative-fixture"
  }
}
