{
  "format": "atlas-content-pack",
  "schemaVersion": 1,
  "payloadSchema": "atlas.bundle@2",
  "id": "atlas.reader-guide",
  "version": "1.0.1",
  "title": "Knowledge Atlas reader guide",
  "visibility": "public",
  "files": {
    "projects": "projects.json",
    "pages": "pages",
    "glossary": "glossary.json"
  },
  "requires": [],
  "assets": [
    {
      "path": "assets/atlas-reader-fixture.pdf",
      "mediaType": "application/pdf",
      "sha256": "0eea0f025b7a63a0c83ee83bafdef900d3bf4ab99ff39db1122eea16ad17c1af"
    },
    {
      "path": "assets/atlas-reader-rotated-fixture.pdf",
      "mediaType": "application/pdf",
      "sha256": "d6633f587f1f36026058c9fbf11d9761c0aab70b9d90224ece4a5aa96786330e"
    },
    {
      "path": "assets/atlas-reader-password-fixture.pdf",
      "mediaType": "application/pdf",
      "sha256": "a969df047c1ad3ecd0e0ee8fc5ebc3d787bd5bfad5af4d17e1bb8acdf14b47ae"
    }
  ],
  "provenance": {
    "kind": "author-created",
    "note": "Original generic application guide; fixture PDFs from the supplied author-created test corpus. No personal library content."
  }
}
